Title,Author(s),Publisher,Year of Publication,ISBN-13 (or ISBN-10),DDC,Status,Date Added,IDtag,class1,class2,class3,Description,DescSrc,Background,Foreground
Linguistic Anthropology,Danesi,Canadian Scholars' Press Inc.,2012,918-1-55130-489-2,306,,,1040,nonfiction,linguistics,,"Anthropologists have always put language at the centre of their agenda.  So too have linguists.  Linguistic anthropology, the amalgam of the two disciplines, aims to document and examine how language mirrors social structure and culture-specific thought patterns.",Book Back Cover,darkseagreen,black
Effective Java [Second Edition],Bloch,Addison-Wesley,2012,978-0-321-35668-0,5,,,1041,nonfiction,software-dev,,,,,
Modern Compiler Design [Second Edition],Grune; Reeuwijk; Bal; Jacobs; Langendoen,Springer,2012,978-1-4614-4698-9,5,,,1042,nonfiction,software-dev,,,,,
"App Empire: Make Money, Have a Life, and Let Technology Work for You",Mureta,"John Wiley & Sons, Inc.",2012,978-1-118-10787-4,5,,,1043,nonfiction,business,,,,,
Brain Puzzlers,Sloane; MacHale,Sterling Publishing,2013,978-1-4351-4649-5,793,,,1045,nonfiction,,,,,,
Javascript & Jquery: Interactive Front-End Web Development,Duckett,"John Wiley & Sons, Inc.",2014,978-1-118-53164-8,5,,,1047,nonfiction,software-dev,,,,,
My Galaxy Note 3,Johnston; Hart-Davis,Pearson Education,2014,978-0-7897-5276-5,4,,,1048,nonfiction,manuals,,,,,
Secrets of Making and Breaking Codes,Nickels,Skyhorse Publishing,2014,978-1-62914-206-7,652,,,1049,nonfiction,,,,,,
Take a Ball of String: 16 Beautiful Projects for your Home,Schlee,Guild of Master Craftsman Pub.,2015,978-1-86108-793-5,746,,,1052,nonfiction,crafts,,,,,
Losing the Signal,McNish; Silcoff,Flatiron,2015,978-1-250-06017-4,338,,,1053,nonfiction,history,,,,,
"Light the Dark: Writers on Creativity, Inspiration, and the Artistic Process",Fassler,Penguin Books,2017,9781524704643,153,,,1054,nonfiction,literature,,Fourty-six of the most acclaimed and exciting authors working today answer a simple yet profound question: What inspires you?,Book Back Cover,lemonchiffon,black
Fundamentals of Electric Circuits [6th Edition],Alexander; Sadiku,McGraw Hill,2017,978-0-07-802822-9,621,,,1055,nonfiction,engineering,,,,,
I Love My Computer Because My Friends Live In It,Leslie,Running Press,2017,978-0-7624-6171-4,302,,,1056,nonfiction,,,,,,
Eat Your Words: A Fascinating Look at the Language of Food,Jones,Delacorte,2018,978-1-5247-6681-8,641,,,1057,nonfiction,linguistics,,"Did you know that you could once buy a camel for 120 bricks of tea?  And you must be wondering why it’s called a hamburger when there’s no ham in it.  The words hot dog, lollipop, and eggplant all have surprising origin stories, too!",Book Back Cover,lightcyan,darkred
The Poisoned City: Flint’s Water and the American Urban Tragedy,"Clark, Anna",Picador,2018,978-1-250-18161-9,363,,,1058,nonfiction,history,,"When the people of Flint, Michigan, turned on their faucets in April 2014, the water pouring out was poisoned with lead and other toxins.  Through a series of disastrous decisions, the state government had switched the city’s water supply to a source that corroded Flint’s aging lead pipes.  Complaints about foul-smelling water were dismissed: the residents of Flint, mostly poor and African American, were not seen as credible, even in matters of their own lives.",Book Back Cover,cadetblue,lemonchiffon
"This Idea is Brilliant: Lost, Overlooked, and Underappreciated Scientific Concepts Everyone Should Know",Brockman,Harper Perennial,2018,978-0-06-269821-6,500,,,1059,nonfiction,,,,,,
Discrete Mathematics [5th Edition],Dossey; Otto; Spence; Vanden Eynden,Pearson,2018,978-0-134-68956-2,511,,,1060,nonfiction,mathematics,,,,,
Elementary Linear Algebra [Ninth Edition],Kolman; Hill,Pearson,2018,9780134718538,512,,,1061,nonfiction,mathematics,,,,,
The Best Résumés for Scientists and Engineers,Lewis,"John Wiley & Sons, Inc.",1988,0-471-62768-2,,,08-06-2025,2501,nonfiction,business,,"A résumé that works for a business person probably wont work for a scientist or engineer.  The technical professional’s résumé has a format, tone, length, and vocabulary all its own.  Now Adele Lewis, founder of one of the largest professional recruiting firms in the country and author of bestselling résumé guides for a variety of targeted professionals shows you – the engineer, academic, or computer scientist – how to write the kind of résumé that makes you stand out.",Book Back Cover,midnightblue,salmon
Minecraft Essential Handbook,Milton; Maron; Soares,Scholastic,2013,978-0-545-68314-2,793,,,1044,nonfiction,Video-games,,,,,
Minecraft Construction Handbook,Needler; Southam,Scholastic,2014,978-0-545-77610-3,793,,,1050,nonfiction,Video-games,,,,,
